<?xml version="1.0" encoding="UTF-8"?>
<xs:schema xmlns:xs="http://www.w3.org/2001/XMLSchema">
    <xs:element name="music">
        <xs:complexType>
            <xs:sequence>
                <xs:element name="track" maxOccurs="unbounded">
                    <xs:complexType>
                        <xs:sequence>
                            <xs:element name="name" type="xs:string" />
                            <xs:element name="artist" type="xs:string" />
                            <xs:element name="album" type="xs:string" />
                            <xs:element name="duration" type="xs:string" />
                            <xs:element name="images" type="xs:string" />
                            <xs:element name="file" type="xs:string" />
                        </xs:sequence>
                    </xs:complexType>
                </xs:element>
            </xs:sequence>
        </xs:complexType>
    </xs:element>
</xs:schema>